{
  "$schema": "https://json-schema.org/draft/2020-12/schema",
  "$id": "https://nelomai.ru/schemas/client/v1/connection-operation.schema.json",
  "type": "object",
  "required": ["api_version", "request_id", "connection"],
  "properties": {
    "stop_acceptance": { "$ref": "common.schema.json#/$defs/stopAcceptance" },
    "api_version": { "$ref": "common.schema.json#/$defs/apiVersion" },
    "request_id": { "$ref": "common.schema.json#/$defs/id" },
    "connection": { "$ref": "common.schema.json#/$defs/connection" }
  },
  "additionalProperties": true
}
