{"api_version":"1","connection":{"egress_mode":"ipv4","layer":"stray","lease_id":"20000000-0000-4000-8000-000000000003","pinned":false,"pool_id":"7","route_mode":"standalone","session_id":"20000000-0000-4000-8000-000000000001","status":"warm","stopped_at":"2026-07-26T09:10:00Z","tic_connection_mode":"dynamic"},"request_id":"req_stop_01","stop_acceptance":{"accepted":true,"cleanup_pending":true,"lease_id":"20000000-0000-4000-8000-000000000003","operation_id":"20000000-0000-4000-8000-000000000006","session_id":"20000000-0000-4000-8000-000000000001"}}